{
  "$schema": "art-assets.schema.json",
  "schema_version": 1,
  "controlled_values": {
    "poses": [
      "neutral_standing",
      "relaxed_standing",
      "arms_folded",
      "holding_cup",
      "hand_to_chest"
    ],
    "expressions": [
      "neutral",
      "gentle_smile",
      "embarrassed",
      "surprised",
      "concerned",
      "tired"
    ],
    "positions": [
      "left",
      "center",
      "right"
    ],
    "framings": [
      "full_body",
      "waist_up"
    ],
    "actions": [
      "run",
      "run_alt",
      "jump",
      "slide",
      "assist",
      "chase",
      "chase_alt",
      "call"
    ],
    "directions": [
      "right"
    ]
  },
  "profiles": {
    "character_sprite": {
      "width": 1024,
      "height": 1536,
      "extensions": [
        ".png"
      ],
      "alpha": "required"
    },
    "background_16_9": {
      "width": 1920,
      "height": 1080,
      "extensions": [
        ".png",
        ".jpg",
        ".jpeg"
      ],
      "alpha": "forbidden"
    },
    "event_cg_16_9": {
      "width": 1920,
      "height": 1080,
      "extensions": [
        ".png",
        ".jpg",
        ".jpeg"
      ],
      "alpha": "forbidden"
    },
    "minigame_sprite": {
      "width": 512,
      "height": 512,
      "extensions": [
        ".png"
      ],
      "alpha": "required"
    },
    "minigame_prop": {
      "width": 512,
      "height": 512,
      "extensions": [
        ".png"
      ],
      "alpha": "required"
    }
  },
  "characters": {
    "harin": {
      "spec": "assets/art/characters/harin/CHARACTER_SPEC.md",
      "master_reference": "NAN_GAME_TITLE/assets/characters/harin-source.png",
      "allowed_poses": [
        "neutral_standing",
        "relaxed_standing",
        "arms_folded",
        "holding_cup",
        "hand_to_chest"
      ],
      "allowed_expressions": [
        "neutral",
        "gentle_smile",
        "embarrassed",
        "surprised",
        "concerned",
        "tired"
      ],
      "allowed_minigame_actions": [
        "run",
        "run_alt",
        "assist"
      ]
    },
    "boss": {
      "spec": "assets/art/characters/boss/CHARACTER_SPEC.md",
      "master_reference": "NAN_GAME_TITLE/assets/characters/boss-standing.png",
      "allowed_poses": [
        "holding_cup"
      ],
      "allowed_expressions": [
        "concerned"
      ],
      "allowed_minigame_actions": [
        "chase",
        "chase_alt",
        "call"
      ]
    },
    "minjae": {
      "spec": "assets/art/characters/minjae/CHARACTER_SPEC.md",
      "master_reference": "NAN_GAME_TITLE/assets/characters/minjae-source.png",
      "allowed_poses": [
        "neutral_standing",
        "relaxed_standing",
        "arms_folded"
      ],
      "allowed_expressions": [
        "neutral",
        "gentle_smile",
        "embarrassed",
        "surprised",
        "concerned",
        "tired"
      ]
    },
    "sea": {
      "spec": "assets/art/characters/sea/CHARACTER_SPEC.md",
      "master_reference": "assets/art/characters/sea/references/sea_master_reference.png",
      "allowed_poses": [
        "neutral_standing"
      ],
      "allowed_expressions": [
        "gentle_smile"
      ]
    },
    "doyun": {
      "spec": "assets/art/characters/doyun/CHARACTER_SPEC.md",
      "master_reference": null,
      "allowed_poses": [
        "neutral_standing"
      ],
      "allowed_expressions": [
        "neutral"
      ],
      "allowed_minigame_actions": [
        "run",
        "run_alt",
        "jump",
        "slide"
      ]
    }
  },
  "assets": [
    {
      "id": "minigame_character.doyun.run.right",
      "kind": "minigame_character",
      "profile": "minigame_sprite",
      "character_id": "doyun",
      "action": "run",
      "direction": "right",
      "active_version": "v003",
      "versions": [
        {
          "version": "v001",
          "status": "review",
          "path": "assets/art/characters/doyun/review/mg_doyun_run_right_v001.png",
          "generation_log_id": "mg-doyun-run-right-v001-imagegen",
          "sha256": null,
          "reviewed_by": null,
          "reviewed_at": null
        },
        {
          "version": "v002",
          "status": "approved",
          "path": "assets/art/characters/doyun/approved/mg_doyun_run_right_v002.png",
          "generation_log_id": "mg-doyun-run-right-v002-normalized",
          "sha256": "09c1e2ccc82dc419fcca487456b63f888481871210ddcf123dc3e73c84432ddb",
          "reviewed_by": "user",
          "reviewed_at": "2026-07-31T20:54:15.9148300+09:00"
        },
        {
          "version": "v003",
          "status": "approved",
          "path": "assets/art/characters/doyun/approved/mg_doyun_run_right_v003.png",
          "generation_log_id": "mg-doyun-run-right-v003-imagegen-anatomy",
          "sha256": "762e34c493b77ac3b38fb352f90dc72ab357a2661d692a4a96e5b927345a9e0a",
          "reviewed_by": "user",
          "reviewed_at": "2026-08-01T10:57:41.1275672+09:00"
        }
      ]
    },
    {
      "id": "minigame_character.doyun.run_alt.right",
      "kind": "minigame_character",
      "profile": "minigame_sprite",
      "character_id": "doyun",
      "action": "run_alt",
      "direction": "right",
      "active_version": "v003",
      "versions": [
        {
          "version": "v001",
          "status": "review",
          "path": "assets/art/characters/doyun/review/mg_doyun_run_alt_right_v001.png",
          "generation_log_id": "mg-doyun-run-alt-right-v001-imagegen",
          "sha256": null,
          "reviewed_by": null,
          "reviewed_at": null
        },
        {
          "version": "v002",
          "status": "review",
          "path": "assets/art/characters/doyun/review/mg_doyun_run_alt_right_v002.png",
          "generation_log_id": "mg-doyun-run-alt-right-v002-imagegen",
          "sha256": null,
          "reviewed_by": null,
          "reviewed_at": null
        },
        {
          "version": "v003",
          "status": "approved",
          "path": "assets/art/characters/doyun/approved/mg_doyun_run_alt_right_v003.png",
          "generation_log_id": "mg-doyun-run-alt-right-v003-imagegen-anatomy",
          "sha256": "8a0190dfea03b08e6ac1f9b392cfcf19137e0ca4345fcab1f33a008e6aac1bf5",
          "reviewed_by": "user",
          "reviewed_at": "2026-08-01T10:57:41.1275672+09:00"
        }
      ]
    },
    {
      "id": "minigame_character.doyun.jump.right",
      "kind": "minigame_character",
      "profile": "minigame_sprite",
      "character_id": "doyun",
      "action": "jump",
      "direction": "right",
      "active_version": "v001",
      "versions": [
        {
          "version": "v001",
          "status": "approved",
          "path": "assets/art/characters/doyun/approved/mg_doyun_jump_right_v001.png",
          "generation_log_id": "mg-doyun-jump-right-v001-review",
          "sha256": "3a684e671ea231dafe716450fc93df79c68b9e3c329fb284a7a644e1ba94e402",
          "reviewed_by": "user",
          "reviewed_at": "2026-08-01T00:37:38.9150322+09:00"
        }
      ]
    },
    {
      "id": "minigame_character.doyun.slide.right",
      "kind": "minigame_character",
      "profile": "minigame_sprite",
      "character_id": "doyun",
      "action": "slide",
      "direction": "right",
      "active_version": "v001",
      "versions": [
        {
          "version": "v001",
          "status": "approved",
          "path": "assets/art/characters/doyun/approved/mg_doyun_slide_right_v001.png",
          "generation_log_id": "mg-doyun-slide-right-v001-review",
          "sha256": "9850edebbc8fd24f137c98578fe0ec39d8068bfa301817ab54d91aaf8f471d35",
          "reviewed_by": "user",
          "reviewed_at": "2026-08-01T00:37:38.9150322+09:00"
        }
      ]
    },
    {
      "id": "minigame_character.harin.run.right",
      "kind": "minigame_character",
      "profile": "minigame_sprite",
      "character_id": "harin",
      "action": "run",
      "direction": "right",
      "active_version": "v002",
      "versions": [
        {
          "version": "v001",
          "status": "approved",
          "path": "assets/art/characters/harin/approved/mg_harin_run_right_v001.png",
          "generation_log_id": "mg-harin-run-right-v001-imagegen",
          "sha256": "754cb03d47be7e183fcdc4ab6b2e2ccee84dbe48a6f83e84a40e267eef8d71d9",
          "reviewed_by": "user",
          "reviewed_at": "2026-08-01T00:37:38.9150322+09:00"
        },
        {
          "version": "v002",
          "status": "approved",
          "path": "assets/art/characters/harin/approved/mg_harin_run_right_v002.png",
          "generation_log_id": "mg-harin-run-right-v002-imagegen-anatomy",
          "sha256": "11278a2454f9c2bfaed847d37c28ac8bbfa5158b43094496ecf7db9f80c66056",
          "reviewed_by": "user",
          "reviewed_at": "2026-08-01T10:57:41.1275672+09:00"
        }
      ]
    },
    {
      "id": "minigame_character.harin.run_alt.right",
      "kind": "minigame_character",
      "profile": "minigame_sprite",
      "character_id": "harin",
      "action": "run_alt",
      "direction": "right",
      "active_version": "v003",
      "versions": [
        {
          "version": "v001",
          "status": "review",
          "path": "assets/art/characters/harin/review/mg_harin_run_alt_right_v001.png",
          "generation_log_id": "mg-harin-run-alt-right-v001-imagegen",
          "sha256": null,
          "reviewed_by": null,
          "reviewed_at": null
        },
        {
          "version": "v002",
          "status": "review",
          "path": "assets/art/characters/harin/review/mg_harin_run_alt_right_v002.png",
          "generation_log_id": "mg-harin-run-alt-right-v002-imagegen",
          "sha256": null,
          "reviewed_by": null,
          "reviewed_at": null
        },
        {
          "version": "v003",
          "status": "approved",
          "path": "assets/art/characters/harin/approved/mg_harin_run_alt_right_v003.png",